### ISSUE TITLE
RSTs are sent in response to traffic between other hosts

### ISSUE THREAD

**Issue by MagnusS** [mirage/mirage-tcpip#113]
To reproduce:

1. SSH to dom0 (or other host on the same bridge as unikernel)
2. Disable ageing on br0 (brctl setageing br0 0)
3. Start a unikernel on br0 (e.g. static_website)
4. Run tcpdump in dom0 to capture traffic on the interface connected to the unikernel (vifxxx.0)

Example output (192.168.56.5 is dom0, 192.168.56.1 is remote ssh client, 192.168.56.60 is unikernel)
```
09:52:14.081382 IP 192.168.56.5.22 > 192.168.56.1.53392: Flags [P.], seq 424:460, ack 1, win 362, options [nop,nop,TS val 83816493 ecr 1280199235], length 36
09:52:14.082406 IP 192.168.56.60.53392 > 192.168.56.5.22: Flags [R.], seq 0, ack 309, win 0, length 0
09:52:14.082432 IP 192.168.56.60.53392 > 192.168.56.5.22: Flags [R.], seq 0, ack 425, win 0, length 0
09:52:15.083714 IP 192.168.56.5.22 > 192.168.56.1.53392: Flags [P.], seq 460:688, ack 1, win 362, options [nop,nop,TS val 83816743 ecr 1280199236], length 228
09:52:15.084340 IP 192.168.56.5.22 > 192.168.56.1.53392: Flags [P.], seq 688:724, ack 1, win 362, options [nop,nop,TS val 83816743 ecr 1280200237], length 36
09:52:15.084894 IP 192.168.56.5.22 > 192.168.56.1.53392: Flags [P.], seq 724:888, ack 1, win 362, options [nop,nop,TS val 83816743 ecr 1280200237], length 164
09:52:15.085697 IP 192.168.56.5.22 > 192.168.56.1.53392: Flags [P.], seq 888:924, ack 1, win 362, options [nop,nop,TS val 83816744 ecr 1280200238], length 36
09:52:15.086701 IP 192.168.56.5.22 > 192.168.56.1.53392: Flags [.], seq 924:2372, ack 1, win 362, options [nop,nop,TS val 83816744 ecr 1280200238], length 1448
09:52:15.086957 IP 192.168.56.5.22 > 192.168.56.1.53392: Flags [P.], seq 2372:2544, ack 1, win 362, options [nop,nop,TS val 83816744 ecr 1280200238], length 172
09:52:15.087943 IP 192.168.56.60.53392 > 192.168.56.5.22: Flags [R.], seq 0, ack 461, win 0, length 0
09:52:15.087972 IP 192.168.56.60.53392 > 192.168.56.5.22: Flags [R.], seq 0, ack 689, win 0, length 0
09:52:15.087981 IP 192.168.56.60.53392 > 192.168.56.5.22: Flags [R.], seq 0, ack 725, win 0, length 0
09:52:15.087988 IP 192.168.56.60.53392 > 192.168.56.5.22: Flags [R.], seq 0, ack 889, win 0, length 0
09:52:15.087995 IP 192.168.56.60.53392 > 192.168.56.5.22: Flags [R.], seq 0, ack 925, win 0, length 0
```

**Comment by hannesm** [comment]
since all traffic is bridged via `br0`, and mirage-tcpip doesn't filter for it's [mac address in ethif](https://github.com/mirage/mirage-tcpip/blob/master/lib/ethif.ml#L41) or it's [ip address](https://github.com/mirage/mirage-tcpip/blob/master/lib/ipv4.ml#L172), it reacts to all packets... should be straightforward to fix :)

**Comment by mor1** [comment]
that would relate to a query @koleini had recently concerning non-promiscuous mode... :)
(should filter by mac in ethif at least i guess.)

**Comment by MagnusS** [comment]
Yes, seems to be fairly easy to fix. About to submit a PR for ethif filter by mac now.
