### ISSUE TITLE
Packets only contain 536 bytes or less

### ISSUE THREAD

**Issue by MagnusS** [mirage/mirage-tcpip#249]
From iperf pcap (iperf test 0):
```
$ tshark -nr tests/pcap/tcp_iperf_two_stacks_basic_10000000.pcap |more
 ...
  5   0.106235   10.0.0.101 → 10.0.0.100   TCP 62 10863→5001 [SYN] Seq=0 Win=5840 Len=0
  6   0.106436   10.0.0.100 → 10.0.0.101   TCP 58 5001→10863 [SYN, ACK] Seq=0 Ack=1 Win=65535 Len=0
  7   0.106554   10.0.0.101 → 10.0.0.100   TCP 54 10863→5001 [ACK] Seq=1 Ack=1 Win=65535 Len=0
  8   0.106791   10.0.0.101 → 10.0.0.100   TCP 590 10863→5001 [PSH, ACK] Seq=1 Ack=1 Win=65535 Len=536
  9   0.106819   10.0.0.100 → 10.0.0.101   TCP 54 5001→10863 [ACK] Seq=1 Ack=537 Win=65535 Len=0
 10   0.106863   10.0.0.101 → 10.0.0.100   TCP 590 10863→5001 [PSH, ACK] Seq=537 Ack=1 Win=65535 Len=536
 11   0.106879   10.0.0.100 → 10.0.0.101   TCP 54 5001→10863 [ACK] Seq=1 Ack=1073 Win=65535 Len=0
 12   0.106905   10.0.0.101 → 10.0.0.100   TCP 442 10863→5001 [PSH, ACK] Seq=1073 Ack=1 Win=65535 Len=388
 13   0.106920   10.0.0.100 → 10.0.0.101   TCP 54 5001→10863 [ACK] Seq=1 Ack=1461 Win=65535 Len=0
[etc]
```

From debugging with @balrajsingh it looks like the MSS option is not included in the SYN and it falls back to 536 bytes.

This seems to be a regression in master, as 2.8.1 has the correct packet length.

**Comment by yomimono** [comment]
Fixed by #249.
