### ISSUE TITLE
Duplicate ACKs sent when closing a connection

### ISSUE THREAD

**Issue by MagnusS** [mirage/mirage-tcpip#162]
Can be seen in the pcap files produced by the tests. Examples:

```
$ tshark -nr tests/pcap/tcp_iperf_two_stacks_basic.pcap | tail -n 5
13710   1.694047   10.0.0.100 -> 10.0.0.101   TCP 54 5001 > 18442 [FIN, ACK] Seq=1 Ack=10000002 Win=262140 Len=0
13711   1.694124   10.0.0.101 -> 10.0.0.100   TCP 54 18442 > 5001 [ACK] Seq=10000002 Ack=2 Win=262140 Len=0
13712   1.694272   10.0.0.100 -> 10.0.0.101   TCP 54 [TCP Dup ACK 13710#1] 5001 > 18442 [ACK] Seq=2 Ack=10000002 Win=262140 Len=0
13713   1.694357   10.0.0.101 -> 10.0.0.100   TCP 54 [TCP Dup ACK 13711#1] 18442 > 5001 [ACK] Seq=10000002 Ack=2 Win=262140 Len=0
13714   1.694397   10.0.0.100 -> 10.0.0.101   TCP 54 5001 > 18442 [RST, ACK] Seq=2 Ack=10000002 Win=0 Len=0
```
```
$ tshark -nr tests/pcap/tcp_iperf_two_stacks_uniform_packet_loss.pcap|tail -n 5
13634  78.002340   10.0.0.100 -> 10.0.0.101   TCP 54 5001 > 19123 [FIN, ACK] Seq=1 Ack=10000002 Win=262140 Len=0
13635  78.002417   10.0.0.101 -> 10.0.0.100   TCP 54 19123 > 5001 [ACK] Seq=10000002 Ack=2 Win=262140 Len=0
13636  78.002566   10.0.0.100 -> 10.0.0.101   TCP 54 [TCP Dup ACK 13634#1] 5001 > 19123 [ACK] Seq=2 Ack=10000002 Win=262140 Len=0
13637  78.002652   10.0.0.101 -> 10.0.0.100   TCP 54 [TCP Dup ACK 13635#1] 19123 > 5001 [ACK] Seq=10000002 Ack=2 Win=262140 Len=0
13638  78.002698   10.0.0.100 -> 10.0.0.101   TCP 54 5001 > 19123 [RST, ACK] Seq=2 Ack=10000002 Win=0 Len=0
```

```
$ tshark -nr tests/pcap/tcp_connect_two_stacks_basic.pcap | tail -n 5
  8   0.102135   10.0.0.101 -> 10.0.0.100   TCP 91 [TCP segment of a reassembled PDU]
  9   0.102217   10.0.0.100 -> 10.0.0.101   TCP 54 80 > 15426 [ACK] Seq=1 Ack=38 Win=262140 Len=0
 10   0.102437   10.0.0.101 -> 10.0.0.100   TCP 54 15426 > 80 [FIN, ACK] Seq=38 Ack=1 Win=262140 Len=0
 11   0.102514   10.0.0.100 -> 10.0.0.101   TCP 54 80 > 15426 [ACK] Seq=1 Ack=39 Win=262140 Len=0
 12   0.102665   10.0.0.100 -> 10.0.0.101   TCP 54 [TCP Dup ACK 11#1] 80 > 15426 [ACK] Seq=1 Ack=39 Win=262140 Len=0
```

Related to this? (from @balrajsingh in #140)

>As you say there is a dup-ack near the beginning but that's from the
"server" and it's acking the FIN that was send from the client, after it
half-closed the connection.  This particular ack is redundant and shouldn't
be there, but it really is quite harmless and doesn't have any effect on
the connection.  I think it's because when a FIN is received an ACK is sent
back immediately, but the delayed-ACK timer thinks the ACK wasn't sent.
The cause of the confusion is probably because the seq number that was
advanced for ACK-ing the FIN was just done adhoc in that packet - the
delayed-ACK timer is looking at the overall connection's seq number.  It
should be fixed, but this one is harmless.

**Comment by hannesm** [comment]
https://github.com/mirage/mirage/issues/233 looks like a duplicate... but not too much information in there
